{"candidate_digest":"de5032e66efdad9eefb0af4b7a113510368c9f02b8790361a053a509b4898daa","candidate_id":"conservative","entries":{"ACTIVATION_CAPABILITY_SET":{"closed_values":null,"comparison":"MINIMUM_CAPABILITY","enforcement_points":["BEFORE_S0_PROFILE_ACTIVATION_PROTECTED_WORK"],"integer_range":[5,null],"reopen_predicate":"REOPEN_IF_ACTIVATION_CAPABILITY_SET_SEMANTICS_OR_BOUND_CHANGES","role":"C03_ACTIVATION_CAPABILITY_INPUT","scope":"PER_PROFILE_ACTIVATION","selected_value":5,"stages":["S0_PROFILE_ACTIVATION"],"unit":"COUNT"},"ACTIVE_FRONTIER":{"closed_values":null,"comparison":"MAXIMUM","enforcement_points":["BEFORE_S4_GRAPH_ADMISSION_PROTECTED_WORK"],"integer_range":[0,8],"reopen_predicate":"REOPEN_IF_ACTIVE_FRONTIER_SEMANTICS_OR_BOUND_CHANGES","role":"C03_SEMANTIC_LIMIT","scope":"PER_CONTEXT_EVALUATION","selected_value":8,"stages":["S4_GRAPH_ADMISSION"],"unit":"COUNT"},"ACTORS":{"closed_values":null,"comparison":"MAXIMUM","enforcement_points":["BEFORE_S0_PROFILE_ACTIVATION_PROTECTED_WORK","BEFORE_S5_AUTHORITY_PROJECTION_PROTECTED_WORK"],"integer_range":[0,2],"reopen_predicate":"REOPEN_IF_ACTORS_SEMANTICS_OR_BOUND_CHANGES","role":"C03_SEMANTIC_LIMIT","scope":"PER_PROFILE_ACTIVATION","selected_value":2,"stages":["S0_PROFILE_ACTIVATION","S5_AUTHORITY_PROJECTION"],"unit":"COUNT"},"ALIASES_PER_CREDENTIAL":{"closed_values":null,"comparison":"MAXIMUM","enforcement_points":["BEFORE_S5_AUTHORITY_PROJECTION_PROTECTED_WORK"],"integer_range":[0,2],"reopen_predicate":"REOPEN_IF_ALIASES_PER_CREDENTIAL_SEMANTICS_OR_BOUND_CHANGES","role":"C03_SEMANTIC_LIMIT","scope":"PER_CREDENTIAL_AND_CONTEXT","selected_value":2,"stages":["S5_AUTHORITY_PROJECTION"],"unit":"COUNT"},"ANCESTRY_RELATIONS":{"closed_values":null,"comparison":"MAXIMUM","enforcement_points":["BEFORE_S4_GRAPH_ADMISSION_PROTECTED_WORK"],"integer_range":[0,1024],"reopen_predicate":"REOPEN_IF_ANCESTRY_RELATIONS_SEMANTICS_OR_BOUND_CHANGES","role":"C03_SEMANTIC_LIMIT","scope":"PER_CONTEXT_EVALUATION","selected_value":1024,"stages":["S4_GRAPH_ADMISSION"],"unit":"COUNT"},"AP_EXPANDED_CONTENT_OCTETS":{"closed_values":null,"comparison":"MAXIMUM","enforcement_points":["BEFORE_S3_KERNEL_STRUCTURAL_PROTECTED_WORK"],"integer_range":[0,32768],"reopen_predicate":"REOPEN_IF_AP_EXPANDED_CONTENT_OCTETS_SEMANTICS_OR_BOUND_CHANGES","role":"C03_SEMANTIC_LIMIT","scope":"PER_CONTEXT_EVALUATION","selected_value":32768,"stages":["S3_KERNEL_STRUCTURAL"],"unit":"OCTETS"},"AP_TRANSITION_BLOCK_OCTETS":{"closed_values":null,"comparison":"MAXIMUM","enforcement_points":["BEFORE_S3_KERNEL_STRUCTURAL_PROTECTED_WORK"],"integer_range":[0,2048],"reopen_predicate":"REOPEN_IF_AP_TRANSITION_BLOCK_OCTETS_SEMANTICS_OR_BOUND_CHANGES","role":"C03_SEMANTIC_LIMIT","scope":"PER_CANONICAL_OBJECT","selected_value":2048,"stages":["S3_KERNEL_STRUCTURAL"],"unit":"OCTETS"},"AUTHORITY_STATES":{"closed_values":null,"comparison":"MAXIMUM","enforcement_points":["BEFORE_S5_AUTHORITY_PROJECTION_PROTECTED_WORK"],"integer_range":[0,128],"reopen_predicate":"REOPEN_IF_AUTHORITY_STATES_SEMANTICS_OR_BOUND_CHANGES","role":"C03_SEMANTIC_LIMIT","scope":"PER_CONTEXT_EVALUATION","selected_value":128,"stages":["S5_AUTHORITY_PROJECTION"],"unit":"COUNT"},"AUTHORITY_TRANSITIONS":{"closed_values":null,"comparison":"MAXIMUM","enforcement_points":["BEFORE_S5_AUTHORITY_PROJECTION_PROTECTED_WORK"],"integer_range":[0,512],"reopen_predicate":"REOPEN_IF_AUTHORITY_TRANSITIONS_SEMANTICS_OR_BOUND_CHANGES","role":"C03_SEMANTIC_LIMIT","scope":"PER_CONTEXT_EVALUATION","selected_value":512,"stages":["S5_AUTHORITY_PROJECTION"],"unit":"COUNT"},"CHECKPOINT_REFERENCES":{"closed_values":null,"comparison":"EXACT_ZERO","enforcement_points":["BEFORE_S3_KERNEL_STRUCTURAL_PROTECTED_WORK","BEFORE_S6_DURABLE_COMMIT_PROTECTED_WORK"],"integer_range":[0,0],"reopen_predicate":"REOPEN_IF_CHECKPOINT_REFERENCES_SEMANTICS_OR_BOUND_CHANGES","role":"C03_EXPLICIT_ZERO_OR_UNSUPPORTED","scope":"PER_CONTEXT_EVALUATION","selected_value":0,"stages":["S3_KERNEL_STRUCTURAL","S6_DURABLE_COMMIT"],"unit":"COUNT"},"CHUNKS_PER_CONTENT":{"closed_values":null,"comparison":"MAXIMUM","enforcement_points":["BEFORE_S3_KERNEL_STRUCTURAL_PROTECTED_WORK"],"integer_range":[0,16],"reopen_predicate":"REOPEN_IF_CHUNKS_PER_CONTENT_SEMANTICS_OR_BOUND_CHANGES","role":"C03_SEMANTIC_LIMIT","scope":"PER_CANONICAL_OBJECT","selected_value":16,"stages":["S3_KERNEL_STRUCTURAL"],"unit":"COUNT"},"CHUNK_OCTETS":{"closed_values":null,"comparison":"MAXIMUM","enforcement_points":["BEFORE_S3_KERNEL_STRUCTURAL_PROTECTED_WORK"],"integer_range":[0,4096],"reopen_predicate":"REOPEN_IF_CHUNK_OCTETS_SEMANTICS_OR_BOUND_CHANGES","role":"C03_SEMANTIC_LIMIT","scope":"PER_CANONICAL_OBJECT","selected_value":4096,"stages":["S3_KERNEL_STRUCTURAL"],"unit":"OCTETS"},"COMMITMENT_VALUE_OCTETS":{"closed_values":[32],"comparison":"MAXIMUM","enforcement_points":["BEFORE_S3_KERNEL_STRUCTURAL_PROTECTED_WORK"],"integer_range":[0,32],"reopen_predicate":"REOPEN_IF_COMMITMENT_VALUE_OCTETS_SEMANTICS_OR_BOUND_CHANGES","role":"C03_SEMANTIC_LIMIT","scope":"PER_CONTEXT_EVALUATION","selected_value":32,"stages":["S3_KERNEL_STRUCTURAL"],"unit":"OCTETS"},"COMPLETE_PATH_COUNT":{"closed_values":null,"comparison":"NON_ENTRY","enforcement_points":[],"integer_range":null,"reopen_predicate":"REOPEN_IF_COMPLETE_PATH_COUNT_SEMANTICS_OR_BOUND_CHANGES","role":"EVIDENCE_ONLY","scope":"PER_CONTEXT_EVALUATION","selected_value":null,"stages":[],"unit":"COUNT"},"CONTENT_EXACT_OCTETS":{"closed_values":null,"comparison":"MAXIMUM","enforcement_points":["BEFORE_S3_KERNEL_STRUCTURAL_PROTECTED_WORK","BEFORE_S6_DURABLE_COMMIT_PROTECTED_WORK"],"integer_range":[0,65536],"reopen_predicate":"REOPEN_IF_CONTENT_EXACT_OCTETS_SEMANTICS_OR_BOUND_CHANGES","role":"C03_SEMANTIC_LIMIT","scope":"PER_CONTEXT_EVALUATION","selected_value":65536,"stages":["S3_KERNEL_STRUCTURAL","S6_DURABLE_COMMIT"],"unit":"OCTETS"},"CONTEXT_LIFETIME_EVENTS":{"closed_values":null,"comparison":"MAXIMUM","enforcement_points":["BEFORE_S4_GRAPH_ADMISSION_PROTECTED_WORK","BEFORE_S6_DURABLE_COMMIT_PROTECTED_WORK"],"integer_range":[0,1024],"reopen_predicate":"REOPEN_IF_CONTEXT_LIFETIME_EVENTS_SEMANTICS_OR_BOUND_CHANGES","role":"C03_SEMANTIC_LIMIT","scope":"PER_CONTEXT_EVALUATION","selected_value":1024,"stages":["S4_GRAPH_ADMISSION","S6_DURABLE_COMMIT"],"unit":"COUNT"},"CONTROL_EVENTS":{"closed_values":null,"comparison":"MAXIMUM","enforcement_points":["BEFORE_S5_AUTHORITY_PROJECTION_PROTECTED_WORK"],"integer_range":[0,16],"reopen_predicate":"REOPEN_IF_CONTROL_EVENTS_SEMANTICS_OR_BOUND_CHANGES","role":"C03_SEMANTIC_LIMIT","scope":"PER_CONTEXT_EVALUATION","selected_value":16,"stages":["S5_AUTHORITY_PROJECTION"],"unit":"COUNT"},"CREDENTIALS":{"closed_values":null,"comparison":"MAXIMUM","enforcement_points":["BEFORE_S5_AUTHORITY_PROJECTION_PROTECTED_WORK"],"integer_range":[0,8],"reopen_predicate":"REOPEN_IF_CREDENTIALS_SEMANTICS_OR_BOUND_CHANGES","role":"C03_SEMANTIC_LIMIT","scope":"PER_CONTEXT_EVALUATION","selected_value":8,"stages":["S5_AUTHORITY_PROJECTION"],"unit":"COUNT"},"CUSTODY_REDUNDANCY":{"closed_values":null,"comparison":"MINIMUM_CAPABILITY","enforcement_points":["BEFORE_S0_PROFILE_ACTIVATION_PROTECTED_WORK","BEFORE_S6_DURABLE_COMMIT_PROTECTED_WORK"],"integer_range":[1,null],"reopen_predicate":"REOPEN_IF_CUSTODY_REDUNDANCY_SEMANTICS_OR_BOUND_CHANGES","role":"C03_ACTIVATION_CAPABILITY_INPUT","scope":"PER_CONTEXT_EVALUATION","selected_value":1,"stages":["S0_PROFILE_ACTIVATION","S6_DURABLE_COMMIT"],"unit":"DECLARED_FAILURE_DOMAIN_COPIES"},"DELIVERY_ATTEMPTS":{"closed_values":null,"comparison":"NON_ENTRY","enforcement_points":["BEFORE_S1_TRANSPORT_ADMISSION_PROTECTED_WORK"],"integer_range":null,"reopen_predicate":"REOPEN_IF_DELIVERY_ATTEMPTS_SEMANTICS_OR_BOUND_CHANGES","role":"POST_C03_LAYER_PROFILE","scope":"PER_CONTEXT_EVALUATION","selected_value":null,"stages":["S1_TRANSPORT_ADMISSION"],"unit":"COUNT"},"DIAGNOSTIC_OCTETS":{"closed_values":null,"comparison":"NON_ENTRY","enforcement_points":["BEFORE_S7_PRESENTATION_PROTECTED_WORK"],"integer_range":null,"reopen_predicate":"REOPEN_IF_DIAGNOSTIC_OCTETS_SEMANTICS_OR_BOUND_CHANGES","role":"POST_C03_LAYER_PROFILE","scope":"PER_CONTEXT_EVALUATION","selected_value":null,"stages":["S7_PRESENTATION"],"unit":"OCTETS"},"DURABLE_RECORDS":{"closed_values":null,"comparison":"MINIMUM_CAPABILITY","enforcement_points":["BEFORE_S0_PROFILE_ACTIVATION_PROTECTED_WORK","BEFORE_S6_DURABLE_COMMIT_PROTECTED_WORK"],"integer_range":[128,null],"reopen_predicate":"REOPEN_IF_DURABLE_RECORDS_SEMANTICS_OR_BOUND_CHANGES","role":"C03_ACTIVATION_CAPABILITY_INPUT","scope":"PER_CONTEXT_EVALUATION","selected_value":128,"stages":["S0_PROFILE_ACTIVATION","S6_DURABLE_COMMIT"],"unit":"COUNT"},"DURABLE_REQUIRED_OCTETS":{"closed_values":null,"comparison":"MINIMUM_CAPABILITY","enforcement_points":["BEFORE_S0_PROFILE_ACTIVATION_PROTECTED_WORK","BEFORE_S6_DURABLE_COMMIT_PROTECTED_WORK"],"integer_range":[1048576,null],"reopen_predicate":"REOPEN_IF_DURABLE_REQUIRED_OCTETS_SEMANTICS_OR_BOUND_CHANGES","role":"C03_ACTIVATION_CAPABILITY_INPUT","scope":"PER_CONTEXT_EVALUATION","selected_value":1048576,"stages":["S0_PROFILE_ACTIVATION","S6_DURABLE_COMMIT"],"unit":"OCTETS"},"EVENTS_ADMITTED":{"closed_values":null,"comparison":"MAXIMUM","enforcement_points":["BEFORE_S4_GRAPH_ADMISSION_PROTECTED_WORK"],"integer_range":[0,32],"reopen_predicate":"REOPEN_IF_EVENTS_ADMITTED_SEMANTICS_OR_BOUND_CHANGES","role":"C03_SEMANTIC_LIMIT","scope":"PER_CONTEXT_EVALUATION","selected_value":32,"stages":["S4_GRAPH_ADMISSION"],"unit":"COUNT"},"EVIDENCE_EXPLORATION_CASES":{"closed_values":null,"comparison":"NON_ENTRY","enforcement_points":[],"integer_range":null,"reopen_predicate":"REOPEN_IF_EVIDENCE_EXPLORATION_CASES_SEMANTICS_OR_BOUND_CHANGES","role":"EVIDENCE_ONLY","scope":"PER_CONTEXT_EVALUATION","selected_value":null,"stages":[],"unit":"COUNT"},"EVIDENCE_PER_CREDENTIAL":{"closed_values":null,"comparison":"MAXIMUM","enforcement_points":["BEFORE_S4_GRAPH_ADMISSION_PROTECTED_WORK","BEFORE_S5_AUTHORITY_PROJECTION_PROTECTED_WORK"],"inte